{"$defs":{"dateTime":{"format":"date-time","type":"string"},"sha256":{"pattern":"^sha256:(?!0{64}$)[0-9a-f]{64}$","type":"string"}},"$id":"https://pleiades.local/schemas/operational-authority-registry-v1.json","$schema":"https://json-schema.org/draft/2020-12/schema","additionalProperties":false,"properties":{"apiVersion":{"const":"modos.pleiades/v1alpha1"},"authority":{"const":{"ceiling":"none","closureOnly":true,"mayExecute":false,"mayIssueAuthority":false,"maySelfModify":false}},"decisionPolicies":{"items":{"additionalProperties":false,"properties":{"actions":{"items":{"pattern":"^[a-z][a-z0-9-]{1,127}$","type":"string"},"minItems":1,"type":"array","uniqueItems":true},"authorizationMode":{"enum":["delegated-machine-executive","mixed-quorum","human-steward"]},"decisionType":{"pattern":"^[a-z][a-z0-9-]{1,63}$","type":"string"},"domains":{"items":{"pattern":"^[a-z][a-z0-9._/-]{1,127}$","type":"string"},"minItems":1,"type":"array","uniqueItems":true},"executorCapability":{"pattern":"^[a-z][a-z0-9._-]{1,127}$","type":"string"},"executorMayApprove":{"type":"boolean"},"grantRequired":{"type":"boolean"},"maximumRejects":{"maximum":16,"minimum":0,"type":"integer"},"proposerMayApprove":{"type":"boolean"},"requiredIndependentAudits":{"maximum":16,"minimum":0,"type":"integer"},"requiredRoleApprovals":{"additionalProperties":{"maximum":16,"minimum":1,"type":"integer"},"minProperties":1,"propertyNames":{"pattern":"^[A-Za-z0-9][A-Za-z0-9._:-]{1,255}$"},"type":"object"},"riskTiers":{"items":{"enum":["observe-only","reversible-local","bounded-persistent","high-impact","constitutional"]},"minItems":1,"type":"array","uniqueItems":true},"rollbackRequired":{"type":"boolean"}},"required":["decisionType","domains","actions","riskTiers","authorizationMode","requiredRoleApprovals","requiredIndependentAudits","maximumRejects","grantRequired","proposerMayApprove","executorMayApprove","executorCapability","rollbackRequired"],"type":"object"},"minItems":1,"type":"array"},"evidencePolicies":{"items":{"additionalProperties":false,"properties":{"allowedClassifications":{"items":{"enum":["public-reference","private-reference","sovereign-decision","live-evidence"]},"minItems":1,"type":"array","uniqueItems":true},"allowedClockSkewSeconds":{"maximum":3600,"minimum":0,"type":"integer"},"allowedIssuerRoles":{"items":{"pattern":"^[A-Za-z0-9][A-Za-z0-9._:-]{1,255}$","type":"string"},"minItems":1,"type":"array","uniqueItems":true},"inputId":{"pattern":"^[A-Za-z][A-Za-z0-9]{1,63}$","type":"string"},"maximumAgeSeconds":{"maximum":31536000,"minimum":1,"type":"integer"},"requireExpiry":{"const":true},"requiredDistinctAttestors":{"maximum":16,"minimum":1,"type":"integer"}},"required":["inputId","allowedClassifications","allowedIssuerRoles","maximumAgeSeconds","requiredDistinctAttestors","requireExpiry","allowedClockSkewSeconds"],"type":"object"},"minItems":1,"type":"array"},"keys":{"items":{"additionalProperties":false,"properties":{"algorithm":{"const":"Ed25519"},"keyRef":{"pattern":"^[A-Za-z0-9][A-Za-z0-9._:-]{1,255}$","type":"string"},"principalRef":{"pattern":"^[A-Za-z0-9][A-Za-z0-9._:-]{1,255}$","type":"string"},"publicKeyBase64":{"pattern":"^[A-Za-z0-9+/]{43}=$","type":"string"},"publicKeyDigest":{"$ref":"#/$defs/sha256"},"status":{"enum":["active","suspended","revoked","expired"]},"validFrom":{"$ref":"#/$defs/dateTime"},"validUntil":{"$ref":"#/$defs/dateTime"}},"required":["keyRef","principalRef","algorithm","publicKeyBase64","publicKeyDigest","status","validFrom","validUntil"],"type":"object"},"minItems":1,"type":"array"},"kind":{"const":"OperationalAuthorityRegistry"},"principals":{"items":{"additionalProperties":false,"properties":{"conflictDomains":{"items":{"pattern":"^[a-z][a-z0-9._/-]{1,127}$","type":"string"},"type":"array","uniqueItems":true},"decisionTypes":{"items":{"pattern":"^[a-z][a-z0-9-]{1,63}$","type":"string"},"type":"array","uniqueItems":true},"evidenceInputs":{"items":{"pattern":"^[A-Za-z][A-Za-z0-9]{1,63}$","type":"string"},"type":"array","uniqueItems":true},"executorCapabilities":{"items":{"pattern":"^[a-z][a-z0-9._-]{1,127}$","type":"string"},"type":"array","uniqueItems":true},"principalRef":{"pattern":"^[A-Za-z0-9][A-Za-z0-9._:-]{1,255}$","type":"string"},"principalType":{"enum":["human","mind","service","institution","auditor"]},"roles":{"items":{"pattern":"^[A-Za-z0-9][A-Za-z0-9._:-]{1,255}$","type":"string"},"minItems":1,"type":"array","uniqueItems":true},"status":{"enum":["active","suspended","revoked","succeeded"]}},"required":["principalRef","principalType","status","roles","evidenceInputs","decisionTypes","executorCapabilities","conflictDomains"],"type":"object"},"minItems":1,"type":"array"},"registryId":{"pattern":"^operational-authority:[a-z0-9][a-z0-9._:-]{2,127}$","type":"string"},"revocations":{"items":{"additionalProperties":false,"properties":{"effectiveAt":{"$ref":"#/$defs/dateTime"},"reasonDigest":{"$ref":"#/$defs/sha256"},"revocationId":{"pattern":"^[A-Za-z0-9][A-Za-z0-9._:-]{1,255}$","type":"string"},"targetRef":{"pattern":"^[A-Za-z0-9][A-Za-z0-9._:-]{1,255}$","type":"string"},"targetType":{"enum":["principal","key","attestation","approval","grant"]}},"required":["revocationId","targetType","targetRef","effectiveAt","reasonDigest"],"type":"object"},"type":"array"},"version":{"minimum":1,"type":"integer"}},"required":["apiVersion","kind","registryId","version","principals","keys","evidencePolicies","decisionPolicies","revocations","authority"],"title":"Pleiades Operational Authority Registry","type":"object"}
