{"apiVersion":"modos.pleiades/v1alpha1","authority":{"ceiling":"none","closureOnly":true,"mayExecute":false,"mayIssueAuthority":false,"maySelfModify":false},"decisionPolicies":[{"actions":["authorize-admission"],"authorizationMode":"mixed-quorum","decisionType":"canary-admission","domains":["ontology"],"executorCapability":"ontology.admission.apply","executorMayApprove":false,"grantRequired":true,"maximumRejects":0,"proposerMayApprove":false,"requiredIndependentAudits":1,"requiredRoleApprovals":{"machine-executive":1,"sovereign-steward":1},"riskTiers":["bounded-persistent"],"rollbackRequired":true},{"actions":["authorize-history-rewrite"],"authorizationMode":"human-steward","decisionType":"history-rewrite","domains":["repository-history"],"executorCapability":"repository.history.rewrite","executorMayApprove":false,"grantRequired":false,"maximumRejects":0,"proposerMayApprove":false,"requiredIndependentAudits":1,"requiredRoleApprovals":{"sovereign-steward":1},"riskTiers":["high-impact"],"rollbackRequired":true},{"actions":["issue-grant"],"authorizationMode":"human-steward","decisionType":"grant-issuance","domains":["authority"],"executorCapability":"authority.grant.issue","executorMayApprove":false,"grantRequired":false,"maximumRejects":0,"proposerMayApprove":false,"requiredIndependentAudits":1,"requiredRoleApprovals":{"sovereign-steward":1},"riskTiers":["constitutional"],"rollbackRequired":true}],"evidencePolicies":[{"allowedClassifications":["private-reference"],"allowedClockSkewSeconds":60,"allowedIssuerRoles":["private-evidence-attestor"],"inputId":"privateEcology","maximumAgeSeconds":86400,"requireExpiry":true,"requiredDistinctAttestors":1},{"allowedClassifications":["private-reference"],"allowedClockSkewSeconds":60,"allowedIssuerRoles":["private-evidence-attestor"],"inputId":"observedInventory","maximumAgeSeconds":86400,"requireExpiry":true,"requiredDistinctAttestors":1},{"allowedClassifications":["live-evidence"],"allowedClockSkewSeconds":30,"allowedIssuerRoles":["live-evidence-attestor"],"inputId":"nodeInventory","maximumAgeSeconds":3600,"requireExpiry":true,"requiredDistinctAttestors":1},{"allowedClassifications":["live-evidence"],"allowedClockSkewSeconds":30,"allowedIssuerRoles":["live-evidence-attestor"],"inputId":"canaryPlan","maximumAgeSeconds":3600,"requireExpiry":true,"requiredDistinctAttestors":1},{"allowedClassifications":["live-evidence"],"allowedClockSkewSeconds":30,"allowedIssuerRoles":["live-evidence-attestor"],"inputId":"observationPlan","maximumAgeSeconds":3600,"requireExpiry":true,"requiredDistinctAttestors":1},{"allowedClassifications":["sovereign-decision"],"allowedClockSkewSeconds":60,"allowedIssuerRoles":["sovereign-steward"],"inputId":"signingIdentity","maximumAgeSeconds":86400,"requireExpiry":true,"requiredDistinctAttestors":1},{"allowedClassifications":["sovereign-decision"],"allowedClockSkewSeconds":60,"allowedIssuerRoles":["sovereign-steward"],"inputId":"historyDecision","maximumAgeSeconds":86400,"requireExpiry":true,"requiredDistinctAttestors":1},{"allowedClassifications":["sovereign-decision"],"allowedClockSkewSeconds":60,"allowedIssuerRoles":["sovereign-steward"],"inputId":"authorityGrant","maximumAgeSeconds":86400,"requireExpiry":true,"requiredDistinctAttestors":1}],"keys":[{"algorithm":"Ed25519","keyRef":"key:synthetic-private-evidence-v1","principalRef":"service:synthetic-private-evidence","publicKeyBase64":"f8F4Y+RKlI5cZF+DrUuOXBz0YNgdg0XJIL3NekvTeUk=","publicKeyDigest":"sha256:faffb8cdb519c0ca322ab65c3c881b8c310d9fe75b54641a1f4624a1a9b81c98","status":"active","validFrom":"2026-07-20T00:00:00Z","validUntil":"2027-07-20T00:00:00Z"},{"algorithm":"Ed25519","keyRef":"key:synthetic-live-evidence-v1","principalRef":"service:synthetic-live-evidence","publicKeyBase64":"xCToCjItWtP5pvIA7Q3dAFhZQVoYNn4aoJhMIYzmKQU=","publicKeyDigest":"sha256:8de202d0d65e33251561bc811f1c02706878677e682bbaffc31a3486fd4b8c28","status":"active","validFrom":"2026-07-20T00:00:00Z","validUntil":"2027-07-20T00:00:00Z"},{"algorithm":"Ed25519","keyRef":"key:synthetic-steward-v1","principalRef":"human:synthetic-steward","publicKeyBase64":"18pTzJdWBUkXA9+iP2tzVIBN1EMtWHfETUX4BiSgWpY=","publicKeyDigest":"sha256:a7decd572888b4877c1b66bc0f66c0abc4dac18b22672330de7a1a91e7b16460","status":"active","validFrom":"2026-07-20T00:00:00Z","validUntil":"2027-07-20T00:00:00Z"},{"algorithm":"Ed25519","keyRef":"key:synthetic-mind-v1","principalRef":"mind:pleiades","publicKeyBase64":"Xr0TKiPshWngZeIwh5M9rmVzRSuE4+ml7QP9VfEPdxQ=","publicKeyDigest":"sha256:3687b5d9ad84b2fa55fab189ea8974053cb87cd14aa80b0e95421b3c4f14c141","status":"active","validFrom":"2026-07-20T00:00:00Z","validUntil":"2027-07-20T00:00:00Z"},{"algorithm":"Ed25519","keyRef":"key:synthetic-auditor-v1","principalRef":"service:synthetic-auditor","publicKeyBase64":"L08F/zQXyBz3RBb930SP6/+v7fgbsarH3S85B1fFv1M=","publicKeyDigest":"sha256:b794d9bb401b7e79dfc62f2c44a62156634fa6577c2a715cc206ccf4c4ed2122","status":"active","validFrom":"2026-07-20T00:00:00Z","validUntil":"2027-07-20T00:00:00Z"}],"kind":"OperationalAuthorityRegistry","principals":[{"conflictDomains":[],"decisionTypes":[],"evidenceInputs":["privateEcology","observedInventory"],"executorCapabilities":[],"principalRef":"service:synthetic-private-evidence","principalType":"service","roles":["private-evidence-attestor"],"status":"active"},{"conflictDomains":[],"decisionTypes":[],"evidenceInputs":["nodeInventory","canaryPlan","observationPlan"],"executorCapabilities":[],"principalRef":"service:synthetic-live-evidence","principalType":"service","roles":["live-evidence-attestor"],"status":"active"},{"conflictDomains":[],"decisionTypes":["canary-admission","grant-issuance","history-rewrite","live-loop","observation-window"],"evidenceInputs":["signingIdentity","historyDecision","authorityGrant"],"executorCapabilities":[],"principalRef":"human:synthetic-steward","principalType":"human","roles":["sovereign-steward"],"status":"active"},{"conflictDomains":[],"decisionTypes":["canary-admission","live-loop","observation-window"],"evidenceInputs":[],"executorCapabilities":[],"principalRef":"mind:pleiades","principalType":"mind","roles":["machine-executive"],"status":"active"},{"conflictDomains":[],"decisionTypes":["canary-admission","grant-issuance","history-rewrite","live-loop","observation-window"],"evidenceInputs":[],"executorCapabilities":[],"principalRef":"service:synthetic-auditor","principalType":"auditor","roles":["independent-auditor"],"status":"active"},{"conflictDomains":[],"decisionTypes":[],"evidenceInputs":[],"executorCapabilities":[],"principalRef":"service:synthetic-proposer","principalType":"service","roles":["proposer"],"status":"active"},{"conflictDomains":[],"decisionTypes":[],"evidenceInputs":[],"executorCapabilities":["ontology.admission.apply"],"principalRef":"service:synthetic-executor","principalType":"service","roles":["executor"],"status":"active"}],"registryId":"operational-authority:synthetic-v1","revocations":[],"version":1}
